[
  {
    "id": "transistoid",
    "display_name": "Транзистоид (маленький паук)",
    "location_id": "loc_motherboard",
    "lore": "Полупроводниковый механический паразит. Использует три металлических вывода (эмиттер, базу и коллектор) для быстрого бега по дорожкам платы.",
    "stats": {
      "max_health": 30,
      "contact_damage": 10,
      "movement_speed": 110.0
    },
    "sprite_variants": [
      "enemy_transistoid_purple",
      "enemy_transistoid_amber"
    ],
    "behavior_type": "jumper",
    "attack": {
      "name": "Искровой прыжок",
      "damage": 12,
      "cooldown_seconds": 2.2,
      "range": 120.0,
      "projectile_type": "none",
      "description": "Прыгает в сторону игрока и при соприкосновении наносит контактный урон."
    },
    "drops": {
      "scrap_parts_min": 1,
      "scrap_parts_max": 2,
      "drop_chance_percent": 70.0
    }
  },
  {
    "id": "swire",
    "display_name": "Свайр (таракан)",
    "location_id": "loc_motherboard",
    "lore": "Шустрый тараканоподобный дрон-кабельщик. Стремительно сокращает дистанцию и атакует заострёнными контактами.",
    "stats": {
      "max_health": 45,
      "contact_damage": 12,
      "movement_speed": 130.0
    },
    "sprite_variants": [
      "enemy_swire"
    ],
    "behavior_type": "patrol_crawler",
    "attack": {
      "name": "Удар лапкой",
      "damage": 14,
      "cooldown_seconds": 1.5,
      "range": 45.0,
      "projectile_type": "melee_slash",
      "description": "Подбегает вплотную к игроку и наносит быстрый резкий удар лапкой."
    },
    "drops": {
      "scrap_parts_min": 1,
      "scrap_parts_max": 2,
      "drop_chance_percent": 75.0
    }
  },
  {
    "id": "bus_drone",
    "display_name": "Шинный дрон (летающий прямоугольник)",
    "location_id": "loc_motherboard",
    "lore": "Прямоугольный зависающий в воздухе модуль системной шины, патрулирующий воздушное пространство над платой.",
    "stats": {
      "max_health": 40,
      "contact_damage": 8,
      "movement_speed": 60.0
    },
    "sprite_variants": [],
    "behavior_type": "flying",
    "attack": {
      "name": "Медленный энергозаряд",
      "damage": 10,
      "cooldown_seconds": 3.0,
      "range": 220.0,
      "projectile_type": "slow_energy_ball",
      "description": "Выпускает в сторону игрока маленький медленно летящий сгусток энергии."
    },
    "drops": {
      "scrap_parts_min": 1,
      "scrap_parts_max": 2,
      "drop_chance_percent": 65.0
    }
  },
  {
    "id": "choke_worm",
    "display_name": "Дроссель-червь",
    "location_id": "loc_power_supply",
    "lore": "Цилиндрический индуктивный червь из медной проволоки на ферритовом кольце. Ползает между радиаторами БП.",
    "stats": {
      "max_health": 55,
      "contact_damage": 14,
      "movement_speed": 70.0
    },
    "sprite_variants": [],
    "behavior_type": "accordion_coil",
    "attack": {
      "name": "Удар пружинного растяжения",
      "damage": 16,
      "cooldown_seconds": 2.0,
      "range": 80.0,
      "projectile_type": "body_extension",
      "description": "Резко сжимается, накапливая энергию, и при распрямлении наносит сильный удар витками."
    },
    "drops": {
      "scrap_parts_min": 1,
      "scrap_parts_max": 3,
      "drop_chance_percent": 80.0
    }
  },
  {
    "id": "capacitor_spitter",
    "display_name": "Электролитный плевун",
    "location_id": "loc_power_supply",
    "lore": "Бочонок электролитического конденсатора с надорванной вздутой крышкой на тонких ножках-контактах.",
    "stats": {
      "max_health": 50,
      "contact_damage": 10,
      "movement_speed": 55.0
    },
    "sprite_variants": [],
    "behavior_type": "spitter",
    "attack": {
      "name": "Плевок электролита",
      "damage": 15,
      "cooldown_seconds": 2.8,
      "range": 180.0,
      "projectile_type": "electrolyte_blob",
      "description": "Медленно перемещается и выплёвывает в игрока едкий химический сгусток электролита."
    },
    "drops": {
      "scrap_parts_min": 1,
      "scrap_parts_max": 2,
      "drop_chance_percent": 75.0
    }
  },
  {
    "id": "flying_transformer",
    "display_name": "Летающий трансформатор",
    "location_id": "loc_power_supply",
    "lore": "Парящий трансформаторный блок с четырьмя длинными гибкими усиками-выводами.",
    "stats": {
      "max_health": 65,
      "contact_damage": 12,
      "movement_speed": 75.0
    },
    "sprite_variants": [],
    "behavior_type": "flying_fan",
    "attack": {
      "name": "Четверной залп",
      "damage": 18,
      "cooldown_seconds": 3.5,
      "range": 200.0,
      "projectile_type": "quad_spark_shot",
      "description": "Зависает над игроком и производит одновременный залп четырьмя электрическими зарядами."
    },
    "drops": {
      "scrap_parts_min": 2,
      "scrap_parts_max": 3,
      "drop_chance_percent": 85.0
    }
  },
  {
    "id": "bit_flipper",
    "display_name": "Бит-флиппер",
    "location_id": "loc_hard_drive",
    "lore": "Плоский жучок с двухцветным поляризованным панцирем. Каждые 5 секунд инвертирует полярность (0 или 1), меняя цвет панциря.",
    "stats": {
      "max_health": 60,
      "contact_damage": 12,
      "movement_speed": 80.0
    },
    "sprite_variants": [],
    "behavior_type": "polarity_flipper",
    "attack": {
      "name": "Магнитная инверсия (Притяжение/Отталкивание)",
      "damage": 14,
      "cooldown_seconds": 2.5,
      "range": 150.0,
      "projectile_type": "magnetic_wave",
      "description": "В зависимости от текущего цвета панциря либо рывком притягивает, либо отталкивает робота, нанося урон."
    },
    "drops": {
      "scrap_parts_min": 1,
      "scrap_parts_max": 3,
      "drop_chance_percent": 80.0
    }
  },
  {
    "id": "flying_needle",
    "display_name": "Летающая игла",
    "location_id": "loc_hard_drive",
    "lore": "Острый микроскопический считывающий наконечник, летающий на подвесе над зеркальными дисками.",
    "stats": {
      "max_health": 40,
      "contact_damage": 20,
      "movement_speed": 160.0
    },
    "sprite_variants": [],
    "behavior_type": "diver",
    "attack": {
      "name": "Пикирующий укол",
      "damage": 22,
      "cooldown_seconds": 2.2,
      "range": 190.0,
      "projectile_type": "dive_thrust",
      "description": "Зависает под потолком и резко на высокой скорости пикирует прямо в игрока, нанося сокрушительный урон."
    },
    "drops": {
      "scrap_parts_min": 1,
      "scrap_parts_max": 2,
      "drop_chance_percent": 75.0
    }
  },
  {
    "id": "data_chip",
    "display_name": "Чип",
    "location_id": "loc_hard_drive",
    "lore": "Квадратный микроконтроллер контроллера накопителя, генерирующий пакеты бинарных данных.",
    "stats": {
      "max_health": 50,
      "contact_damage": 10,
      "movement_speed": 65.0
    },
    "sprite_variants": [],
    "behavior_type": "bouncing_projectile",
    "attack": {
      "name": "Рикошетящий сгусток данных",
      "damage": 14,
      "cooldown_seconds": 3.0,
      "range": 220.0,
      "projectile_type": "bouncing_data_orb",
      "description": "Выстреливает сгустком данных; если снаряд не попал в цель сразу, он несколько раз отскакивает от пола рикошетом."
    },
    "drops": {
      "scrap_parts_min": 1,
      "scrap_parts_max": 2,
      "drop_chance_percent": 70.0
    }
  },
  {
    "id": "spider",
    "display_name": "Паук-ползун (модель SOIC-8)",
    "lore": "Восьминогий механический паук. Лапки-выводы цепляются за любую поверхность платы: ползает по полу, стенам и потолку, огибая выступы.",
    "sprite_variants": [
      "enemy_spider"
    ],
    "rig_id": "spider_rig",
    "stats": {
      "max_health": 18,
      "contact_damage": 6,
      "movement_speed": 38.0
    },
    "behavior_type": "crawler",
    "attack": {
      "name": "Укус",
      "damage": 8,
      "cooldown_seconds": 1.5,
      "range": 14.0,
      "description": "Кусает героя, если тот оказался рядом с телом."
    },
    "drops": {
      "scrap_parts_min": 1,
      "scrap_parts_max": 1,
      "drop_chance_percent": 50.0
    }
  },
  {
    "id": "worm",
    "display_name": "Червь-землерой (модель DIP-14)",
    "lore": "Сегментированный механический червь длиной от трёх до пяти секций. Ползёт по полу, стенам и потолку, а потом вдруг зарывается в блок и выныривает в другом месте.",
    "sprite_variants": [
      "enemy_worm"
    ],
    "rig_id": "worm_rig",
    "stats": {
      "max_health": 40,
      "contact_damage": 10,
      "movement_speed": 30.0
    },
    "behavior_type": "burrower",
    "attack": {
      "name": "Укус",
      "damage": 12,
      "cooldown_seconds": 1.8,
      "range": 18.0,
      "description": "Кусает зубастой пастью, если герой оказался перед головой."
    },
    "drops": {
      "scrap_parts_min": 1,
      "scrap_parts_max": 2,
      "drop_chance_percent": 60.0
    }
  },
  {
    "id": "spider_mother",
    "display_name": "Паучиха-матка (модель SOIC-16)",
    "lore": "Огромная паучиха, которая сидит прямо на фоне — на стене платы — и тревожно шевелит лапками. Время от времени выплёвывает паучков, которые падают на платформы и расползаются.",
    "sprite_variants": [
      "enemy_spider_mother"
    ],
    "rig_id": "spider_mother_rig",
    "stats": {
      "max_health": 60,
      "contact_damage": 0,
      "movement_speed": 0.0
    },
    "behavior_type": "spawner",
    "attack": {
      "name": "Выплюнуть паучка",
      "damage": 8,
      "cooldown_seconds": 9.0,
      "range": 200.0,
      "description": "Выплёвывает паука, который падает на платформы и ползёт по поверхностям."
    },
    "spawns": {
      "enemy_id": "spider",
      "sprite_id": "enemy_spider",
      "interval_seconds": [
        6.0,
        12.0
      ],
      "max_alive": 4,
      "lifetime_seconds": 40.0
    },
    "drops": {
      "scrap_parts_min": 2,
      "scrap_parts_max": 3,
      "drop_chance_percent": 80.0
    }
  }
]
